gameId,rowid,trialNum,name,pResp,text,span,normalized_span,referent,flowers,color
Rq47E8uzWFKm4CBPJ,643,1,Minu,6,Ill take the yellow flower with the orange seeds in the middle,the yellow flower with the orange seeds in the middle,the yellow flower with the orange seeds in the middle,6,"9:12, 1:7, 5:5, 6:4, 3:3, 7:1",yellow
Rq47E8uzWFKm4CBPJ,644,1,Repi,1,I'm taking the same as last time (the orange tipped one),the same as last time (the orange tipped one),the same as last time (the orange tipped one),1,"9:12, 1:7, 5:5, 6:4, 3:3, 7:1",yellow
Rq47E8uzWFKm4CBPJ,647,2,Minu,2,Ill take the orange flower with the red center,the orange flower with the red center,the yellow flower with the red center,2,"2:12, 10:8, 1:6, 12:4, 7:3, 6:1",yellow
Rq47E8uzWFKm4CBPJ,648,2,Minu,2,*yellow,*yellow,,2,"2:12, 10:8, 1:6, 12:4, 7:3, 6:1",yellow
Rq47E8uzWFKm4CBPJ,649,2,Laju,10,ill take the dandelion,the dandelion,the dandelion,10,"2:12, 10:8, 1:6, 12:4, 7:3, 6:1",yellow
Rq47E8uzWFKm4CBPJ,652,2,Repi,1,Can anyone see the value bar for the one that looks like a buttercup?,the one that looks like a buttercup,the one that looks like a buttercup,7,"2:12, 10:8, 1:6, 12:4, 7:3, 6:1",yellow
Rq47E8uzWFKm4CBPJ,653,2,Laju,10,super low,,,,"2:12, 10:8, 1:6, 12:4, 7:3, 6:1",yellow
Rq47E8uzWFKm4CBPJ,655,3,Repi,8,I'm taking the one that looks like 4 round flowers,the one that looks like 4 round flowers,the one that looks like 4 round flowers,8,"8:11, 7:9, 1:6, 4:4, 12:3, 11:1",yellow
Rq47E8uzWFKm4CBPJ,656,3,Laju,1,ill take the yellow with orange tips,the yellow with orange tips,the yellow with orange tips,1,"8:11, 7:9, 1:6, 4:4, 12:3, 11:1",yellow
Rq47E8uzWFKm4CBPJ,660,4,Minu,5,Ill take the one with 3 flowers,the one with 3 flowers,the one with 3 flowers,5,"5:12, 10:8, 2:6, 6:4, 4:3, 1:2",yellow
Rq47E8uzWFKm4CBPJ,662,4,Repi,10,I'm going for the dandelion,the dandelion,the dandelion,10,"5:12, 10:8, 2:6, 6:4, 4:3, 1:2",yellow
Rq47E8uzWFKm4CBPJ,663,4,Laju,2,Ill take the red centered one,the red centered one,the red centered one,2,"5:12, 10:8, 2:6, 6:4, 4:3, 1:2",yellow
Rq47E8uzWFKm4CBPJ,666,5,Repi,8,I'm going for the 4 round flowers,the 4 round flowers,the 4 round flowers,8,"7:12, 8:9, 4:7, 9:6, 1:4, 10:1",yellow
Rq47E8uzWFKm4CBPJ,668,5,Laju,7,Ill take the one with petals and a visible middle....idk really know how to describe it,the one with petals and a visible middle,the one with petals and a visible middle,7,"7:12, 8:9, 4:7, 9:6, 1:4, 10:1",yellow
Rq47E8uzWFKm4CBPJ,669,5,Laju,7,it has a visable stem,a visable stem,a visible stem,7,"7:12, 8:9, 4:7, 9:6, 1:4, 10:1",yellow
Rq47E8uzWFKm4CBPJ,672,6,Laju,10,ill take the dandelion,the dandelion,the dandelion,10,"10:10, 8:9, 2:8, 11:6, 7:4, 6:1",yellow
Rq47E8uzWFKm4CBPJ,674,6,Minu,8,Ill take the one with 4 flowers,the one with 4 flowers,the one with 4 flowers,8,"10:10, 8:9, 2:8, 11:6, 7:4, 6:1",yellow
Rq47E8uzWFKm4CBPJ,677,7,Laju,10,ill take the dandelion,the dandelion,the dandelion,10,"4:11, 10:8, 1:7, 9:3, 6:2, 12:1",yellow
Rq47E8uzWFKm4CBPJ,679,7,Repi,4,I'mm taking the one that's a bunch of flowers,the one that's a bunch of flowers,the one that's a bunch of flowers,4,"4:11, 10:8, 1:7, 9:3, 6:2, 12:1",yellow
Rq47E8uzWFKm4CBPJ,682,8,Laju,5,ill take the three flowers,the three flowers,the three flowers,5,"5:11, 10:9, 6:8, 3:5, 8:2, 4:1",yellow
Rq47E8uzWFKm4CBPJ,684,8,Repi,10,I'm taking the one dandelion,the one dandelion,the one dandelion,10,"5:11, 10:9, 6:8, 3:5, 8:2, 4:1",yellow
Rq47E8uzWFKm4CBPJ,687,9,Laju,1,ill take the one with orange tips,the one with orange tips,the one with orange tips,1,"12:10, 1:8, 8:6, 7:4, 5:3, 11:2",yellow
Rq47E8uzWFKm4CBPJ,689,9,Minu,12,Im taking the one with seeds on the center,the one with seeds on the center,the one with seeds on the center,12,"12:10, 1:8, 8:6, 7:4, 5:3, 11:2",yellow
Rq47E8uzWFKm4CBPJ,692,10,Laju,3,ill take the one with the brown center,the one with the brown center,the one with the brown center,3,"3:11, 2:8, 12:5, 5:4, 8:3, 11:2",yellow
Rq47E8uzWFKm4CBPJ,694,10,Minu,2,Im taking the one with the red center,the one with the red center,the one with the red center,2,"3:11, 2:8, 12:5, 5:4, 8:3, 11:2",yellow
Rq47E8uzWFKm4CBPJ,697,11,Laju,12,ill take the one with the seeds in the center,the one with the seeds in the center,the one with the seeds in the center,12,"4:11, 12:6, 10:5, 7:4, 1:3, 9:2",yellow
Rq47E8uzWFKm4CBPJ,698,11,Repi,4,I'll take the bunch of flowers,the bunch of flowers,the bunch of flowers,4,"4:11, 12:6, 10:5, 7:4, 1:3, 9:2",yellow
Rq47E8uzWFKm4CBPJ,702,12,Laju,11,ill take the droopy one,the droopy one,the droopy one,11,"11:12, 4:9, 3:7, 5:5, 10:4, 9:1",yellow
Rq47E8uzWFKm4CBPJ,704,12,Minu,4,Im taking the bunch of flower,the bunch of flower,the bunch of flower,4,"11:12, 4:9, 3:7, 5:5, 10:4, 9:1",yellow
Rq47E8uzWFKm4CBPJ,707,13,Laju,1,ill take the orange tip one,the orange tip one,the orange tip one,1,"1:11, 11:8, 2:7, 12:6, 8:5, 5:4",yellow
Rq47E8uzWFKm4CBPJ,709,13,Repi,11,I'm taking the droopy one,the droopy one,the droopy one,11,"1:11, 11:8, 2:7, 12:6, 8:5, 5:4",yellow
Rq47E8uzWFKm4CBPJ,712,14,Laju,1,ill take the orange tip one,the orange tip one,the orange tip one,1,"1:12, 4:9, 11:8, 6:7, 8:4, 3:2",yellow
Rq47E8uzWFKm4CBPJ,714,14,Minu,11,Ill take the droppy one,the droppy one,the droopy one,11,"1:12, 4:9, 11:8, 6:7, 8:4, 3:2",yellow
Rq47E8uzWFKm4CBPJ,717,15,Laju,12,ill take the seed center one,the seed center one,the seed center one,12,"12:12, 10:9, 6:8, 11:7, 5:6, 7:2",yellow
Rq47E8uzWFKm4CBPJ,718,15,Repi,10,I'll take dandelion,dandelion,dandelion,10,"12:12, 10:9, 6:8, 11:7, 5:6, 7:2",yellow
Rq47E8uzWFKm4CBPJ,722,16,Laju,10,ill take the dandelion,the dandelion,the dandelion,10,"10:10, 6:9, 2:4, 3:3, 7:2, 9:1",yellow
Rq47E8uzWFKm4CBPJ,724,16,Minu,6,Ill take the orange sees one,the orange sees one,the orange sees one,6,"10:10, 6:9, 2:4, 3:3, 7:2, 9:1",yellow
Rq47E8uzWFKm4CBPJ,726,16,Repi,2,I'll take the red centre,the red centre,the red centre,2,"10:10, 6:9, 2:4, 3:3, 7:2, 9:1",yellow
Rq47E8uzWFKm4CBPJ,728,17,Laju,12,ill take the seed one,the seed one,the seed one,12,"12:10, 3:8, 1:7, 10:6, 6:5, 9:2",yellow
Rq47E8uzWFKm4CBPJ,730,17,Repi,3,Taking the brown centre,the brown centre,the brown centre,3,"12:10, 3:8, 1:7, 10:6, 6:5, 9:2",yellow
Rq47E8uzWFKm4CBPJ,733,18,Laju,1,orange tips,orange tips,orange tips,1,"1:10, 5:8, 2:4, 3:3, 10:2, 9:1",yellow
Rq47E8uzWFKm4CBPJ,735,18,Minu,5,3 flowers,3 flowers,3 flowers,5,"1:10, 5:8, 2:4, 3:3, 10:2, 9:1",yellow
Rq47E8uzWFKm4CBPJ,738,19,Minu,6,Orange seeds in center,Orange seeds in center,Orange seeds in center,6,"7:12, 6:8, 4:7, 8:6, 2:3, 11:2",yellow
Rq47E8uzWFKm4CBPJ,740,19,Laju,7,exposed stem,exposed stem,exposed stem,7,"7:12, 6:8, 4:7, 8:6, 2:3, 11:2",yellow
Rq47E8uzWFKm4CBPJ,743,20,Repi,8,Bunch of 4,Bunch of 4,Bunch of 4,8,"8:12, 12:8, 11:7, 2:5, 10:2, 6:1",yellow
Rq47E8uzWFKm4CBPJ,744,20,Laju,12,seeds in center,seeds in center,seeds in center,12,"8:12, 12:8, 11:7, 2:5, 10:2, 6:1",yellow
Rq47E8uzWFKm4CBPJ,748,21,Laju,11,droopy,droopy,droopy,11,"5:12, 11:9, 12:8, 2:6, 7:5, 4:4",yellow
Rq47E8uzWFKm4CBPJ,749,21,Minu,5,3 flowers,3 flowers,3 flowers,5,"5:12, 11:9, 12:8, 2:6, 7:5, 4:4",yellow
Rq47E8uzWFKm4CBPJ,753,22,Laju,11,droopy,droopy,droopy,11,"6:11, 11:8, 8:7, 7:5, 12:2, 1:1",yellow
Rq47E8uzWFKm4CBPJ,754,22,Minu,6,Orange seeds in center,Orange seeds in center,Orange seeds in center,6,"6:11, 11:8, 8:7, 7:5, 12:2, 1:1",yellow
Rq47E8uzWFKm4CBPJ,758,23,Laju,9,daffodil,daffodil,daffodil,9,"9:10, 6:8, 7:7, 12:6, 5:5, 8:3",yellow
Rq47E8uzWFKm4CBPJ,760,23,Minu,7,Stem,Stem,Stem,7,"9:10, 6:8, 7:7, 12:6, 5:5, 8:3",yellow
ryif2joSqP2QPBCAQ,1190,0,Laju,10,small red flower with the green background is the best for me,small red flower with the green background,small red flower with the green background,10,"6:12, 10:7, 2:6, 1:5, 5:3, 11:2",red
ryif2joSqP2QPBCAQ,1191,0,Repi,1,Which one did you pick?,,,,"6:12, 10:7, 2:6, 1:5, 5:3, 11:2",red
ryif2joSqP2QPBCAQ,1192,0,Minu,6,I picked pink,pink,pink,6,"6:12, 10:7, 2:6, 1:5, 5:3, 11:2",red
ryif2joSqP2QPBCAQ,1193,0,Minu,6,with a dark background and longer green stem in the middle,with a dark background and longer green stem in the middle,with a dark background and longer green stem in the middle,6,"6:12, 10:7, 2:6, 1:5, 5:3, 11:2",red
ryif2joSqP2QPBCAQ,1194,0,Laju,10,ok im going to pick the one with the light green leaves background and small red flowers,the one with the light green leaves background and small red flowers,the one with the light green leaves background and small red flowers,10,"6:12, 10:7, 2:6, 1:5, 5:3, 11:2",red
ryif2joSqP2QPBCAQ,1196,0,Repi,1,"Okay, I will pick a different one.",,,,"6:12, 10:7, 2:6, 1:5, 5:3, 11:2",red
ryif2joSqP2QPBCAQ,1199,1,Minu,8,I picked the 3 small flowers in a row,the 3 small flowers in a row,the 3 small flowers in a row,8,"8:12, 3:8, 7:7, 1:6, 4:5, 5:3",red
ryif2joSqP2QPBCAQ,1200,1,Laju,3,im going to pick the red flower with a yellow tip in the middle,the red flower with a yellow tip in the middle,the red flower with a yellow tip in the middle,3,"8:12, 3:8, 7:7, 1:6, 4:5, 5:3",red
ryif2joSqP2QPBCAQ,1202,1,Repi,7,Best for me is the one with two large flowers and three smaller,the one with two large flowers and three smaller,the one with two large flowers and three smaller,7,"8:12, 3:8, 7:7, 1:6, 4:5, 5:3",red
ryif2joSqP2QPBCAQ,1205,2,Minu,1,"I picked the pinkish/red flower with 8 petals, light green leaves and yellow in middle","the pinkish/red flower with 8 petals, light green leaves and yellow in middle","the pinkish/red flower with 8 petals, light green leaves and yellow in middle",1,"1:12, 8:9, 10:8, 11:7, 4:5, 5:1",red
ryif2joSqP2QPBCAQ,1206,2,Laju,8,im going to pick the three in a row,the three in a row,the three in a row,8,"1:12, 8:9, 10:8, 11:7, 4:5, 5:1",red
ryif2joSqP2QPBCAQ,1210,3,Minu,6,I picked the same one as earlier with long green stem sticking out and pink,the same one as earlier with long green stem sticking out and pink,the same one as earlier with long green stem sticking out and pink,6,"6:10, 3:9, 8:8, 10:5, 12:3, 5:2",red
ryif2joSqP2QPBCAQ,1211,3,Laju,3,red flower with yellow tip in the middle is best for me,red flower with yellow tip in the middle,red flower with yellow tip in the middle,3,"6:10, 3:9, 8:8, 10:5, 12:3, 5:2",red
ryif2joSqP2QPBCAQ,1213,3,Repi,8,"Okay, i'll pick the three in a row",the three in a row,the three in a row,8,"6:10, 3:9, 8:8, 10:5, 12:3, 5:2",red
ryif2joSqP2QPBCAQ,1216,4,Minu,6,picked the one with long green stem again,the one with long green stem,the one with long green stem,6,"6:11, 10:8, 4:7, 1:5, 11:4, 8:3",red
ryif2joSqP2QPBCAQ,1217,4,Laju,10,"ill pick the light green background, small red flower again","the light green background, small red flower","the light green background, small red flower",10,"6:11, 10:8, 4:7, 1:5, 11:4, 8:3",red
ryif2joSqP2QPBCAQ,1221,5,Minu,12,picked the pink with yellow tips,the pink with yellow tips,the pink with yellow tips,12,"12:12, 10:9, 1:8, 2:4, 6:3, 9:1",red
ryif2joSqP2QPBCAQ,1222,5,Minu,12,3 flowers in the image,3 flowers,3 flowers,12,"12:12, 10:9, 1:8, 2:4, 6:3, 9:1",red
ryif2joSqP2QPBCAQ,1223,5,Laju,1,red petals with green background is best for me,red petals with green background,red petals with green background,1,"12:12, 10:9, 1:8, 2:4, 6:3, 9:1",red
ryif2joSqP2QPBCAQ,1227,6,Minu,2,red poinsettias I picked.,red poinsettias,red poinsettias,2,"2:10, 11:8, 12:6, 4:4, 1:3, 9:2",red
ryif2joSqP2QPBCAQ,1228,6,Laju,11,im picking the red flower with yellow in the middle,the red flower with yellow in the middle,the red flower with yellow in the middle,11,"2:10, 11:8, 12:6, 4:4, 1:3, 9:2",red
ryif2joSqP2QPBCAQ,1230,6,Repi,12,"Okay, I'll go for pink with yellow tips",pink with yellow tips,pink with yellow tips,12,"2:10, 11:8, 12:6, 4:4, 1:3, 9:2",red
ryif2joSqP2QPBCAQ,1233,7,Minu,10,picked really small pink and mostly green leaves,really small pink and mostly green leaves,really small pink and mostly green leaves,10,"10:10, 12:9, 4:8, 11:7, 7:4, 3:3",red
ryif2joSqP2QPBCAQ,1234,7,Laju,11,im picking the same as last time,the same as last time,the same as last time,11,"10:10, 12:9, 4:8, 11:7, 7:4, 3:3",red
ryif2joSqP2QPBCAQ,1238,8,Minu,8,picked the 3 in a row,the 3 in a row,the 3 in a row,8,"8:11, 1:7, 7:6, 5:4, 2:3, 11:1",red
ryif2joSqP2QPBCAQ,1239,8,Laju,1,the red petals with the light green background,the red petals with the light green background,the red petals with the light green background,1,"8:11, 1:7, 7:6, 5:4, 2:3, 11:1",red
ryif2joSqP2QPBCAQ,1243,9,Minu,1,picked pink with petals hanging downwards,pink with petals hanging downwards,pink with petals hanging downwards,1,"1:12, 7:9, 10:8, 2:6, 11:5, 3:2",red
ryif2joSqP2QPBCAQ,1244,9,Laju,10,small red flower with green background,small red flower with green background,small red flower with green background,10,"1:12, 7:9, 10:8, 2:6, 11:5, 3:2",red
ryif2joSqP2QPBCAQ,1246,9,Repi,2,"Minu, does yours have green leaves?",green leaves,green leaves,1,"1:12, 7:9, 10:8, 2:6, 11:5, 3:2",red
ryif2joSqP2QPBCAQ,1250,10,Laju,7,red lillies,red lillies,red lilies,7,"7:12, 4:9, 11:8, 6:4, 8:3, 2:1",red
ryif2joSqP2QPBCAQ,1251,10,Minu,4,picked 1 single flower,1 single flower,1 single flower,4,"7:12, 4:9, 11:8, 6:4, 8:3, 2:1",red
ryif2joSqP2QPBCAQ,1254,11,Minu,12,yellow tips,yellow tips,yellow tips,12,"12:11, 8:8, 11:7, 4:4, 1:3, 5:2",red
ryif2joSqP2QPBCAQ,1255,11,Laju,8,is the three in a row valuable? cant see it,the three in a row,the three in a row,8,"12:11, 8:8, 11:7, 4:4, 1:3, 5:2",red
ryif2joSqP2QPBCAQ,1256,11,Repi,11,Yes,,,,"12:11, 8:8, 11:7, 4:4, 1:3, 5:2",red
ryif2joSqP2QPBCAQ,1257,11,Minu,12,yes,,,,"12:11, 8:8, 11:7, 4:4, 1:3, 5:2",red
ryif2joSqP2QPBCAQ,1259,11,Laju,8,ok ill do that,,,,"12:11, 8:8, 11:7, 4:4, 1:3, 5:2",red
ryif2joSqP2QPBCAQ,1263,12,Laju,4,the single flower Minu picked last time,the single flower Minu picked last time,the single flower Minu picked last time,4,"4:12, 11:8, 6:5, 8:3, 9:2, 7:1",red
ryif2joSqP2QPBCAQ,1264,12,Minu,11,big pink flower with yellow dots in middle,big pink flower with yellow dots in middle,big pink flower with yellow dots in middle,11,"4:12, 11:8, 6:5, 8:3, 9:2, 7:1",red
ryif2joSqP2QPBCAQ,1265,12,Repi,6,what has most value outside those?,,,,"4:12, 11:8, 6:5, 8:3, 9:2, 7:1",red
ryif2joSqP2QPBCAQ,1266,12,Minu,11,one with green stem in middle,one with green stem in middle,one with green stem in middle,6,"4:12, 11:8, 6:5, 8:3, 9:2, 7:1",red
ryif2joSqP2QPBCAQ,1267,12,Laju,4,the most for me is dark background with stem in middle,dark background with stem in middle,dark background with stem in middle,6,"4:12, 11:8, 6:5, 8:3, 9:2, 7:1",red
ryif2joSqP2QPBCAQ,1271,13,Laju,8,3 in a row,3 in a row,3 in a row,8,"8:10, 6:9, 9:8, 5:5, 2:4, 10:1",red
ryif2joSqP2QPBCAQ,1272,13,Minu,8,3 in a row for me,3 in a row,3 in a row,8,"8:10, 6:9, 9:8, 5:5, 2:4, 10:1",red
ryif2joSqP2QPBCAQ,1273,13,Laju,8,oh ill change mine,,,,"8:10, 6:9, 9:8, 5:5, 2:4, 10:1",red
ryif2joSqP2QPBCAQ,1274,13,Laju,8,oh no,,,,"8:10, 6:9, 9:8, 5:5, 2:4, 10:1",red
ryif2joSqP2QPBCAQ,1275,13,Repi,6,"Green stem is best for me, ill do that.",Green stem,Green stem,6,"8:10, 6:9, 9:8, 5:5, 2:4, 10:1",red
ryif2joSqP2QPBCAQ,1277,14,Laju,8,ill let minu go first,,,,"8:10, 1:9, 7:8, 9:6, 3:5, 12:1",red
ryif2joSqP2QPBCAQ,1279,14,Minu,1,I picked pink with petals downwards,pink with petals downwards,pink with petals downwards,1,"8:10, 1:9, 7:8, 9:6, 3:5, 12:1",red
ryif2joSqP2QPBCAQ,1280,14,Laju,8,ok ill pick 3 in a row,3 in a row,3 in a row,8,"8:10, 1:9, 7:8, 9:6, 3:5, 12:1",red
ryif2joSqP2QPBCAQ,1284,15,Minu,5,pink and white flower,pink and white flower,pink and white flower,5,"5:12, 10:8, 11:7, 3:3, 4:2, 8:1",red
ryif2joSqP2QPBCAQ,1286,15,Laju,10,small red flower with light green background,small red flower with light green background,small red flower with light green background,10,"5:12, 10:8, 11:7, 3:3, 4:2, 8:1",red
ryif2joSqP2QPBCAQ,1289,16,Minu,8,3 in row,3 in row,3 in row,8,"10:12, 8:7, 11:5, 7:4, 2:2, 3:1",red
ryif2joSqP2QPBCAQ,1290,16,Laju,10,small red flower with light green background again,small red flower with light green background,small red flower with light green background,10,"10:12, 8:7, 11:5, 7:4, 2:2, 3:1",red
ryif2joSqP2QPBCAQ,1292,16,Repi,7,Whats the next best value?,,,,"10:12, 8:7, 11:5, 7:4, 2:2, 3:1",red
ryif2joSqP2QPBCAQ,1293,16,Laju,10,big flower with yellow dots for me,big flower with yellow dots,big flower with yellow dots,11,"10:12, 8:7, 11:5, 7:4, 2:2, 3:1",red
ryif2joSqP2QPBCAQ,1294,16,Minu,8,one with 5 flowers,one with 5 flowers,one with 5 flowers,7,"10:12, 8:7, 11:5, 7:4, 2:2, 3:1",red
ryif2joSqP2QPBCAQ,1295,16,Minu,8,not sure how to describe it best,,,,"10:12, 8:7, 11:5, 7:4, 2:2, 3:1",red
ryif2joSqP2QPBCAQ,1296,16,Repi,7,"Okay, ill do that.",,,,"10:12, 8:7, 11:5, 7:4, 2:2, 3:1",red
ryif2joSqP2QPBCAQ,1299,17,Minu,10,picked one with small pink flowers,one with small pink flowers,one with small pink flowers,10,"10:10, 3:9, 2:8, 4:7, 8:3, 7:2",red
ryif2joSqP2QPBCAQ,1301,17,Laju,3,single red flower with yellow tip in the middle,single red flower with yellow tip in the middle,single red flower with yellow tip in the middle,3,"10:10, 3:9, 2:8, 4:7, 8:3, 7:2",red
ryif2joSqP2QPBCAQ,1304,18,Minu,3,yellow stem in middle,yellow stem in middle,yellow stem in middle,3,"10:11, 3:9, 1:8, 8:6, 7:2, 12:1",red
ryif2joSqP2QPBCAQ,1305,18,Laju,10,red flowers with light green background,red flowers with light green background,red flowers with light green background,10,"10:11, 3:9, 1:8, 8:6, 7:2, 12:1",red
ryif2joSqP2QPBCAQ,1307,18,Repi,1,small red flowers? or petals downwards?,small red flowers,small red flowers,10,"10:11, 3:9, 1:8, 8:6, 7:2, 12:1",red
ryif2joSqP2QPBCAQ,1307,18,Repi,1,small red flowers? or petals downwards?,petals downwards,petals downwards,1,"10:11, 3:9, 1:8, 8:6, 7:2, 12:1",red
ryif2joSqP2QPBCAQ,1308,18,Laju,10,small,small,small,10,"10:11, 3:9, 1:8, 8:6, 7:2, 12:1",red
ryif2joSqP2QPBCAQ,1311,19,Minu,8,3 small flowers,3 small flowers,3 small flowers,8,"8:10, 3:9, 1:8, 5:7, 7:2, 2:1",red
ryif2joSqP2QPBCAQ,1313,19,Laju,5,the big red  flower with yellow in the middle,the big red  flower with yellow in the middle,the big red  flower with yellow in the middle,5,"8:10, 3:9, 1:8, 5:7, 7:2, 2:1",red
ryif2joSqP2QPBCAQ,1316,20,Minu,4,1 big pink flower,1 big pink flower,1 big pink flower,4,"4:11, 6:7, 9:6, 5:5, 3:4, 8:2",red
ryif2joSqP2QPBCAQ,1317,20,Laju,6,the dark green background with the stem in the middle,the dark green background with the stem in the middle,the dark green background with the stem in the middle,6,"4:11, 6:7, 9:6, 5:5, 3:4, 8:2",red
ryif2joSqP2QPBCAQ,1321,21,Minu,6,green stem,green stem,green stem,6,"6:11, 5:8, 4:7, 8:6, 7:2, 12:1",red
ryif2joSqP2QPBCAQ,1322,21,Laju,5,big single flower with yellow in the middle,big single flower with yellow in the middle,big single flower with yellow in the middle,5,"6:11, 5:8, 4:7, 8:6, 7:2, 12:1",red
ryif2joSqP2QPBCAQ,1324,21,Repi,4,"which has more value, three in a row or one big pink flower?",three in a row,three in a row,8,"6:11, 5:8, 4:7, 8:6, 7:2, 12:1",red
ryif2joSqP2QPBCAQ,1324,21,Repi,4,"which has more value, three in a row or one big pink flower?",one big pink flower,one big pink flower,4,"6:11, 5:8, 4:7, 8:6, 7:2, 12:1",red
ryif2joSqP2QPBCAQ,1325,21,Minu,6,big pink!,big pink!,big pink!,4,"6:11, 5:8, 4:7, 8:6, 7:2, 12:1",red
ryif2joSqP2QPBCAQ,1328,22,Minu,10,small flowers mostly green,small flowers mostly green,small flowers mostly green,10,"10:11, 1:9, 7:8, 6:5, 9:2, 11:1",red
ryif2joSqP2QPBCAQ,1329,22,Laju,1,petals pointing downwards for me,petals pointing downwards,petals pointing downwards,1,"10:11, 1:9, 7:8, 6:5, 9:2, 11:1",red
ryif2joSqP2QPBCAQ,1333,23,Minu,8,3 flowers,3 flowers,3 flowers,8,"8:11, 3:9, 2:7, 1:5, 9:3, 4:1",red
ryif2joSqP2QPBCAQ,1334,23,Laju,3,the red flower with yellow tip in the middle,the red flower with yellow tip in the middle,the red flower with yellow tip in the middle,3,"8:11, 3:9, 2:7, 1:5, 9:3, 4:1",red
rzxpsi2uYcPZFHxKS,1799,0,Minu,6,i'll do the white with the big yellow ball in the middle,the white with the big yellow ball in the middle,the white with the big yellow ball in the middle,6,"1:12, 6:8, 3:6, 10:5, 4:4, 12:3",white
rzxpsi2uYcPZFHxKS,1802,1,Minu,1,ill do the colorful one,the colorful one,the colorful one,1,"1:10, 7:9, 2:8, 11:7, 6:6, 5:5",white
rzxpsi2uYcPZFHxKS,1803,1,Laju,7,ill do the one with pink in the middle,the one with pink in the middle,the one with pink in the middle,7,"1:10, 7:9, 2:8, 11:7, 6:6, 5:5",white
rzxpsi2uYcPZFHxKS,1806,2,Minu,9,ill do the one with the 6 petals,the one with the 6 petals,the one with the 6 petals,9,"1:10, 9:8, 6:7, 11:6, 7:4, 4:1",white
rzxpsi2uYcPZFHxKS,1807,2,Minu,9,looks like a starfish,looks like a starfish,looks like a starfish,9,"1:10, 9:8, 6:7, 11:6, 7:4, 4:1",white
rzxpsi2uYcPZFHxKS,1809,2,Laju,1,ill do the one with purple in the middle,the one with purple in the middle,the one with purple in the middle,1,"1:10, 9:8, 6:7, 11:6, 7:4, 4:1",white
rzxpsi2uYcPZFHxKS,1812,3,Laju,5,ill do the one w green in the middle,the one w green in the middle,the one w green in the middle,5,"11:12, 10:9, 5:8, 4:4, 9:3, 7:1",white
rzxpsi2uYcPZFHxKS,1814,3,Repi,11,ill do the one with 5 flowers,the one with 5 flowers,the one with 5 flowers,11,"11:12, 10:9, 5:8, 4:4, 9:3, 7:1",white
rzxpsi2uYcPZFHxKS,1816,3,Minu,7,ill do the one with pink,the one with pink,the one with pink,7,"11:12, 10:9, 5:8, 4:4, 9:3, 7:1",white
rzxpsi2uYcPZFHxKS,1818,4,Laju,7,ill do the one with pink in the middle,the one with pink in the middle,the one with pink in the middle,7,"7:12, 4:9, 6:5, 2:3, 12:2, 10:1",white
rzxpsi2uYcPZFHxKS,1819,4,Minu,4,ill do the three flowers with yellow,the three flowers with yellow,the three flowers with yellow,4,"7:12, 4:9, 6:5, 2:3, 12:2, 10:1",white
rzxpsi2uYcPZFHxKS,1823,5,Laju,11,ill do the one with 5 flowers that looks sideways,the one with 5 flowers that looks sideways,the one with 5 flowers that looks sideways,11,"11:12, 2:9, 12:8, 1:7, 8:4, 3:2",white
rzxpsi2uYcPZFHxKS,1825,5,Minu,2,ill do the two flowers with yellow in the middle,the two flowers with yellow in the middle,the two flowers with yellow in the middle,2,"11:12, 2:9, 12:8, 1:7, 8:4, 3:2",white
rzxpsi2uYcPZFHxKS,1826,5,Repi,1,ill do the colorful one,the colorful one,the colorful one,1,"11:12, 2:9, 12:8, 1:7, 8:4, 3:2",white
rzxpsi2uYcPZFHxKS,1829,6,Repi,8,ill do the pink one,the pink one,the pink one,8,"8:12, 6:8, 3:7, 2:4, 9:2, 12:1",white
rzxpsi2uYcPZFHxKS,1831,6,Laju,6,ill do the one with the yellow ball thing in the middle,the one with the yellow ball thing in the middle,the one with the yellow ball thing in the middle,6,"8:12, 6:8, 3:7, 2:4, 9:2, 12:1",white
rzxpsi2uYcPZFHxKS,1833,6,Minu,3,ill do the one with three,the one with three,the one with three,3,"8:12, 6:8, 3:7, 2:4, 9:2, 12:1",white
rzxpsi2uYcPZFHxKS,1835,7,Laju,8,ill do the one w pink,the one w pink,the one w pink,8,"8:11, 12:9, 10:7, 4:4, 11:3, 3:1",white
rzxpsi2uYcPZFHxKS,1837,7,Repi,11,ill do the one with 5 flowers,the one with 5 flowers,the one with 5 flowers,11,"8:11, 12:9, 10:7, 4:4, 11:3, 3:1",white
rzxpsi2uYcPZFHxKS,1839,7,Minu,12,ill do the one with 4 petals,the one with 4 petals,the one with 4 petals,12,"8:11, 12:9, 10:7, 4:4, 11:3, 3:1",white
rzxpsi2uYcPZFHxKS,1841,8,Minu,12,ill do the 4 petals,the 4 petals,the 4 petals,12,"3:12, 12:9, 11:8, 2:7, 10:4, 4:1",white
rzxpsi2uYcPZFHxKS,1843,8,Repi,2,ill do the one with 2 flowers,the one with 2 flowers,the one with 2 flowers,2,"3:12, 12:9, 11:8, 2:7, 10:4, 4:1",white
rzxpsi2uYcPZFHxKS,1846,9,Minu,10,ill do the one turned to the side,the one turned to the side,the one turned to the side,10,"10:12, 4:9, 6:6, 9:4, 1:3, 12:1",white
rzxpsi2uYcPZFHxKS,1848,9,Laju,4,ill do the one w three,the one w three,the one w three,4,"10:12, 4:9, 6:6, 9:4, 1:3, 12:1",white
rzxpsi2uYcPZFHxKS,1851,10,Laju,8,ill do the one w pink,the one w pink,the one w pink,8,"5:12, 8:9, 11:7, 1:6, 6:4, 3:2",white
rzxpsi2uYcPZFHxKS,1853,10,Minu,5,ill do the 3 flowers with green,the 3 flowers with green,the 3 flowers with green,5,"5:12, 8:9, 11:7, 1:6, 6:4, 3:2",white
rzxpsi2uYcPZFHxKS,1856,11,Minu,8,ill do the pink,the pink,the pink,8,"3:12, 9:8, 10:7, 8:4, 6:3, 4:2",white
rzxpsi2uYcPZFHxKS,1858,11,Repi,3,ill do the ones on the vine,the ones on the vine,the ones on the vine,3,"3:12, 9:8, 10:7, 8:4, 6:3, 4:2",white
rzxpsi2uYcPZFHxKS,1861,12,Minu,8,pink beady one,pink beady one,pink beady one,8,"9:10, 8:9, 2:8, 7:6, 1:2, 6:1",white
rzxpsi2uYcPZFHxKS,1863,12,Repi,9,"ill do the one with 6 petals, starfish","the one with 6 petals, starfish","the one with 6 petals, starfish",9,"9:10, 8:9, 2:8, 7:6, 1:2, 6:1",white
rzxpsi2uYcPZFHxKS,1866,13,Repi,6,one with yellow ball in middle,one with yellow ball in middle,one with yellow ball in middle,6,"6:10, 1:7, 3:6, 4:5, 10:4, 5:1",white
rzxpsi2uYcPZFHxKS,1868,13,Minu,4,3 with yellow,3 with yellow,3 with yellow,4,"6:10, 1:7, 3:6, 4:5, 10:4, 5:1",white
rzxpsi2uYcPZFHxKS,1871,14,Laju,4,3 w yellow,3 w yellow,3 w yellow,4,"4:10, 11:9, 6:8, 1:7, 7:4, 12:1",white
rzxpsi2uYcPZFHxKS,1872,14,Minu,1,purple,purple,purple,1,"4:10, 11:9, 6:8, 1:7, 7:4, 12:1",white
rzxpsi2uYcPZFHxKS,1876,15,Laju,11,5,5,5,11,"11:11, 1:9, 10:8, 2:7, 6:4, 9:3",white
rzxpsi2uYcPZFHxKS,1878,15,Minu,1,purple,purple,purple,1,"11:11, 1:9, 10:8, 2:7, 6:4, 9:3",white
rzxpsi2uYcPZFHxKS,1881,16,Laju,4,3 w yellow,3 w yellow,3 w yellow,4,"4:10, 11:9, 6:8, 7:5, 10:4, 9:2",white
rzxpsi2uYcPZFHxKS,1882,16,Minu,11,5,5,5,11,"4:10, 11:9, 6:8, 7:5, 10:4, 9:2",white
rzxpsi2uYcPZFHxKS,1886,17,Laju,6,yellow ball,yellow ball,yellow ball,6,"12:11, 6:8, 3:6, 7:5, 2:2, 8:1",white
rzxpsi2uYcPZFHxKS,1888,17,Repi,12,4 petals,4 petals,4 petals,12,"12:11, 6:8, 3:6, 7:5, 2:2, 8:1",white
rzxpsi2uYcPZFHxKS,1891,18,Laju,7,pink,pink,pink,7,"11:10, 7:8, 12:7, 10:5, 6:3, 4:1",white
rzxpsi2uYcPZFHxKS,1893,18,Minu,11,5,5,5,11,"11:10, 7:8, 12:7, 10:5, 6:3, 4:1",white
